{
  "key": "bullmq.jobs.waiting",
  "brief": "The number of BullMQ jobs that Job.moveToWait() moved back to the wait state.",
  "instrument": "counter",
  "unit": "none",
  "is_in_otel": false,
  "requirement_level": "opt_in",
  "attributes": [
    "messaging.destination.name",
    "messaging.bullmq.job.name",
    "messaging.bullmq.job.status",
    "messaging.bullmq.job.state"
  ]
}
