{
  "key": "messaging.bullmq.jobs.waiting_children",
  "brief": "The number of BullMQ jobs that moved to the waiting-children state to wait for their child jobs.",
  "instrument": "counter",
  "unit": "none",
  "is_in_otel": false,
  "requirement_level": "recommended",
  "attributes": ["messaging.destination.name", "messaging.bullmq.job.name", "messaging.bullmq.job.state"]
}
